{
  "version": 2,
  "editableReferenceVersion": 2,
  "rooms": [
    {
      "id": "example-room",
      "name": "Example room",
      "surface": "oak",
      "points": [
        { "x": 400, "y": 200 },
        { "x": 700, "y": 200 },
        { "x": 700, "y": 500 },
        { "x": 400, "y": 500 }
      ],
      "label": { "x": 420, "y": 220 }
    }
  ],
  "walls": [
    { "id": "example-wall", "x1": 400, "y1": 200, "x2": 700, "y2": 200, "finish": "plaster" }
  ],
  "items": [
    {
      "id": "example-table",
      "type": "table",
      "name": "Dining table",
      "x": 550,
      "y": 350,
      "w": 165,
      "h": 108,
      "rotation": 0,
      "entityId": ""
    },
    {
      "id": "example-ceiling-light",
      "type": "ceilingLight",
      "name": "Example ceiling light",
      "x": 610,
      "y": 290,
      "w": 58,
      "h": 58,
      "rotation": 0,
      "entityId": "light.example_living_room"
    },
    {
      "id": "example-camera-preview",
      "type": "cameraThumbnail",
      "name": "Example entry camera",
      "x": 650,
      "y": 425,
      "w": 150,
      "h": 100,
      "rotation": 0,
      "entityId": "camera.example_entry",
      "imageEntityId": "image.example_entry_event",
      "previewMode": "event"
    }
  ],
  "hotspots": [
    {
      "id": "example-shade-control",
      "type": "state-icon",
      "entity": "cover.example_shade",
      "title": "Example shade",
      "style": { "left": "36%", "top": "34%" },
      "tap_action": { "action": "more-info" }
    }
  ]
}
